{
  "$schema": "http://json-schema.org/draft-07/schema#",
  "$id": "scanfinder-video-script/v1",
  "title": "ScanFinder tutorial video script",
  "description": "Machine-readable script for tools/video_tutorials/scanfinder_video_runner.py. Times: each step starts when the previous one ends; a step's duration_sec includes its own action time. t=0 is the start of the recording; the first step starts at lead_in_sec.",
  "type": "object",
  "required": ["version", "title", "steps"],
  "additionalProperties": false,
  "properties": {
    "version": { "const": 1 },
    "title": { "type": "string", "minLength": 1 },
    "description": { "type": "string", "description": "One-line summary of what the video teaches." },
    "target_length_sec": { "type": "number", "minimum": 15, "maximum": 180, "description": "Advisory — the planned total is derived from the steps." },
    "lead_in_sec": { "type": "number", "minimum": 0, "default": 1.0, "description": "Still frames before the first step." },
    "lead_out_sec": { "type": "number", "minimum": 0, "default": 1.5, "description": "Still frames after the last step." },
    "app": {
      "type": "object",
      "additionalProperties": false,
      "properties": {
        "window_title": { "type": "string", "default": "ScanFinder", "description": "Title of the app's MAIN window (exact match preferred, substring accepted; any dash style)." },
        "cdp_port": { "type": "integer", "default": 9222, "description": "Chrome DevTools port for selector targets. DEV app only: npm start -- --remote-debugging-port=9222." },
        "maximize": { "type": "boolean", "default": true, "description": "Maximise the main window before recording (recommended: child windows open maximised too)." },
        "exe": { "type": "string", "description": "Default executable for launch_app steps." }
      }
    },
    "record": {
      "type": "object",
      "additionalProperties": false,
      "properties": {
        "mode": { "enum": ["window", "screen", "region"], "default": "window" },
        "window": { "type": "string", "description": "Window whose frame is captured in mode=window (default app.window_title)." },
        "region": { "type": "array", "items": { "type": "integer" }, "minItems": 4, "maxItems": 4, "description": "[x, y, w, h] screen pixels for mode=region." },
        "backdrop": { "type": "string", "description": "Colour (e.g. '#1f2430') for a plain full-screen window placed BEHIND the app — hides the desktop/other apps when the recorded windows are small (sign-in, wizard). mode=screen crops to the work area (no taskbar)." },
        "fps": { "type": "integer", "minimum": 10, "maximum": 60, "default": 30 }
      }
    },
    "captions": {
      "type": "object",
      "additionalProperties": false,
      "properties": {
        "position": { "enum": ["bottom", "top"], "default": "bottom" },
        "font": { "type": "string", "default": "Segoe UI" },
        "font_size": { "type": "integer", "default": 26 },
        "color": { "type": "string", "default": "#ffffff" },
        "background": { "type": "string", "default": "#141414" },
        "opacity": { "type": "number", "minimum": 0.2, "maximum": 1, "default": 0.92 },
        "margin": { "type": "integer", "default": 56, "description": "Pixels from the region edge." },
        "max_width_frac": { "type": "number", "default": 0.8 },
        "pad_x": { "type": "integer", "default": 28 },
        "pad_y": { "type": "integer", "default": 14 }
      }
    },
    "steps": {
      "type": "array",
      "minItems": 1,
      "items": { "$ref": "#/definitions/step" }
    }
  },
  "definitions": {
    "target": {
      "type": "object",
      "description": "Exactly ONE of selector | rel | abs | image, plus optional window + offset.",
      "additionalProperties": false,
      "properties": {
        "selector": { "type": "string", "description": "CSS selector resolved live in the named window over DevTools (dev app only)." },
        "rel": { "type": "array", "items": { "type": "number", "minimum": 0, "maximum": 1 }, "minItems": 2, "maxItems": 2, "description": "[fx, fy] fraction of the window's client area." },
        "abs": { "type": "array", "items": { "type": "number" }, "minItems": 2, "maxItems": 2, "description": "[x, y] absolute screen pixels." },
        "image": { "type": "string", "description": "PNG of the control, path relative to the script file; pyautogui image search." },
        "confidence": { "type": "number", "minimum": 0.5, "maximum": 1, "description": "Image-match tolerance (needs opencv-python)." },
        "window": { "type": "string", "description": "Which app window the selector/rel is in (default app.window_title). Use the exact titles: 'ScanFinder', 'ScanFinder — Review', 'ScanFinder — Search', 'Scan Finder — Settings', 'Teach a new document — Scan Finder'." },
        "offset": { "type": "array", "items": { "type": "number" }, "minItems": 2, "maxItems": 2, "description": "[dx, dy] pixels added to the resolved point." },
        "at": { "type": "array", "items": { "type": "number", "minimum": 0, "maximum": 1 }, "minItems": 2, "maxItems": 2, "description": "Selector targets only: [fx, fy] point inside the element's box as fractions (default centre) — e.g. a spot on a page canvas." }
      },
      "oneOf": [
        { "required": ["selector"] },
        { "required": ["rel"] },
        { "required": ["abs"] },
        { "required": ["image"] }
      ]
    },
    "wait_for": {
      "type": "object",
      "additionalProperties": false,
      "description": "Pre-condition checked before the step's action runs (retries until timeout; not charged to duration_sec).",
      "properties": {
        "window": { "type": "string", "description": "A window with this title must exist (native dialogs too, e.g. 'Select the folder of scanned documents to import')." },
        "selector": { "type": "string", "description": "This element must be visible in `window`." },
        "timeout": { "type": "number", "default": 10 }
      },
      "anyOf": [ { "required": ["window"] }, { "required": ["selector"] } ]
    },
    "step": {
      "type": "object",
      "required": ["id", "action", "duration_sec"],
      "additionalProperties": false,
      "properties": {
        "id": { "type": "string", "pattern": "^[a-z0-9_]+$" },
        "action": { "enum": ["move_and_click", "click", "double_click", "right_click", "move_to", "drag", "type_text", "press_keys", "scroll", "wait", "focus_window", "launch_app", "eval_js"] },
        "from": { "$ref": "#/definitions/target", "description": "drag: start point." },
        "to": { "$ref": "#/definitions/target", "description": "drag: end point." },
        "drag_duration": { "type": "number", "description": "drag: seconds for the drag glide (default 0.9)." },
        "js": { "type": "string", "description": "eval_js: JavaScript evaluated in the named window's page over DevTools (dev app only)." },
        "target": { "$ref": "#/definitions/target" },
        "wait_for": { "$ref": "#/definitions/wait_for" },
        "narration": { "type": "string", "description": "Spoken line for the later TTS pass. Empty for silent steps. Keep to ~2.5 words per second of duration." },
        "caption": { "type": "string", "description": "Short on-screen phrase (≤ 8 words). Empty hides the overlay for this step." },
        "duration_sec": { "type": "number", "minimum": 0, "description": "Total time the step occupies, including its own action." },
        "optional": { "type": "boolean", "description": "If true, a failing action is logged and the run continues." },

        "button": { "enum": ["left", "right", "middle"], "description": "move_and_click: mouse button." },
        "clicks": { "type": "integer", "minimum": 1, "description": "move_and_click: click count." },
        "move_duration": { "type": "number", "description": "Seconds for the cursor glide (default 0.6)." },
        "hover_sec": { "type": "number", "description": "Pause after arriving before clicking (default 0.25)." },
        "resolve_timeout": { "type": "number", "description": "Seconds to keep retrying the target lookup (default 8)." },

        "text": { "type": "string", "description": "type_text: text to type (target optional — clicks it first)." },
        "interval": { "type": "number", "description": "type_text: seconds per character (default 0.045)." },
        "clear": { "type": "boolean", "description": "type_text: Ctrl+A + Backspace first." },
        "enter": { "type": "boolean", "description": "type_text: press Enter afterwards." },

        "keys": { "oneOf": [ { "type": "string" }, { "type": "array", "items": { "type": "string" } } ], "description": "press_keys: one key ('enter', 'escape', 'tab') or a chord (['ctrl', 'f'])." },
        "presses": { "type": "integer", "minimum": 1 },

        "amount": { "type": "integer", "description": "scroll: wheel units, negative = down." },

        "window": { "type": "string", "description": "focus_window: title to bring to front." },
        "maximize": { "type": "boolean", "description": "focus_window: also maximise." },
        "timeout": { "type": "number", "description": "focus_window / launch_app: seconds to wait for the window." },

        "exe": { "type": "string", "description": "launch_app: executable (or .cmd)." },
        "args": { "type": "array", "items": { "type": "string" } },
        "cwd": { "type": "string" },
        "shell": { "type": "boolean" },
        "wait_for_window": { "type": "string", "description": "launch_app: window title that signals the app is up." }
      }
    }
  }
}
