{
  "version": 1,
  "title": "_create_admin (internal — record.py --reuse-part-a: silently create the demo admin so the app lands on the Terms window)",
  "lead_in_sec": 0.2,
  "lead_out_sec": 0.2,
  "app": { "window_title": "ScanFinder", "cdp_port": 9222, "maximize": false },
  "record": { "mode": "screen" },
  "steps": [
    { "id": "settle", "action": "wait",
      "wait_for": { "window": "ScanFinder — Sign in", "selector": "#setup-username", "timeout": 30 },
      "narration": "", "caption": "", "duration_sec": 2.5 },
    { "id": "setup_username", "action": "type_text",
      "target": { "selector": "#setup-username", "window": "ScanFinder — Sign in" }, "text": "{{USER}}",
      "narration": "", "caption": "", "duration_sec": 0.8 },
    { "id": "setup_display", "action": "type_text",
      "target": { "selector": "#setup-display-name", "window": "ScanFinder — Sign in" }, "text": "Demo Admin",
      "narration": "", "caption": "", "duration_sec": 0.8 },
    { "id": "setup_password", "action": "type_text",
      "target": { "selector": "#setup-password", "window": "ScanFinder — Sign in" }, "text": "{{PASS}}",
      "narration": "", "caption": "", "duration_sec": 0.8 },
    { "id": "setup_confirm", "action": "type_text",
      "target": { "selector": "#setup-confirm", "window": "ScanFinder — Sign in" }, "text": "{{PASS}}",
      "narration": "", "caption": "", "duration_sec": 0.8 },
    { "id": "setup_submit", "action": "move_and_click",
      "target": { "selector": "#btn-setup-submit", "window": "ScanFinder — Sign in" },
      "narration": "", "caption": "", "duration_sec": 2 },
    { "id": "recovery_ack", "action": "move_and_click",
      "wait_for": { "window": "ScanFinder — Sign in", "selector": "#recovery-ack", "timeout": 20 },
      "target": { "selector": "#recovery-ack", "window": "ScanFinder — Sign in" },
      "narration": "", "caption": "", "duration_sec": 1 },
    { "id": "recovery_continue", "action": "move_and_click",
      "target": { "selector": "#btn-recovery-continue", "window": "ScanFinder — Sign in" },
      "narration": "", "caption": "", "duration_sec": 2.5 }
  ]
}
