{
  "version": 1,
  "title": "First run A: create the administrator account + the licence screen",
  "description": "Segment A of the first-run video. Filmed on a demo profile with NO licence rows so the licence screen appears after the account is created; it is explained and hovered only (a real Start-trial click would contact the licensing server). record.py --licence-intro films this, restores the licence, and joins segment B in front of the Terms window.",
  "lead_in_sec": 1.0,
  "lead_out_sec": 0.5,
  "app": { "window_title": "ScanFinder", "cdp_port": 9222, "maximize": false },
  "record": { "mode": "screen", "fps": 30, "backdrop": "#1f2430" },
  "captions": { "position": "bottom", "font_size": 28, "margin": 90 },
  "steps": [
    { "id": "intro", "action": "wait",
      "wait_for": { "window": "ScanFinder — Sign in", "selector": "#setup-username", "timeout": 60 },
      "narration": "The first time ScanFinder opens, it asks you to create the administrator account — the one that manages users, settings and filing. There are no default logins; everything stays on this computer.",
      "caption": "First run: create the administrator account", "duration_sec": 9.5 },

    { "id": "username", "action": "type_text",
      "target": { "selector": "#setup-username", "window": "ScanFinder — Sign in" }, "text": "admin",
      "narration": "First, a username — what you'll type to sign in.",
      "caption": "1. Username — what you type to sign in", "duration_sec": 6 },
    { "id": "display_name", "action": "type_text",
      "target": { "selector": "#setup-display-name", "window": "ScanFinder — Sign in" }, "text": "Demo Admin",
      "narration": "Then a display name, shown inside the app.",
      "caption": "2. Display name — shown in the app", "duration_sec": 4.5 },
    { "id": "password", "action": "type_text",
      "target": { "selector": "#setup-password", "window": "ScanFinder — Sign in" }, "text": "Scan-Finder-2026",
      "narration": "Now a password of at least eight characters. Choose a passphrase you'll remember — ScanFinder is offline, so there's no forgot-password email.",
      "caption": "3. Password — 8+ characters, no email reset exists", "duration_sec": 9 },
    { "id": "confirm", "action": "type_text",
      "target": { "selector": "#setup-confirm", "window": "ScanFinder — Sign in" }, "text": "Scan-Finder-2026",
      "narration": "Type it again to confirm.", "caption": "4. Confirm it", "duration_sec": 3.5 },
    { "id": "create", "action": "move_and_click",
      "target": { "selector": "#btn-setup-submit", "window": "ScanFinder — Sign in" },
      "narration": "Click Create administrator account.", "caption": "5. Create administrator account", "duration_sec": 3.5 },

    { "id": "recovery", "action": "move_to",
      "wait_for": { "window": "ScanFinder — Sign in", "selector": "#recovery-ack", "timeout": 20 },
      "target": { "selector": "#btn-recovery-print", "window": "ScanFinder — Sign in" },
      "narration": "This recovery code is shown once. It's the only way to reset the administrator password if it's forgotten — print or copy it now and keep it safe, away from the PC.",
      "caption": "SAVE THIS CODE — shown once, the only way to reset", "duration_sec": 11.5 },
    { "id": "recovery_ack", "action": "move_and_click",
      "target": { "selector": "#recovery-ack", "window": "ScanFinder — Sign in" },
      "narration": "Tick to confirm you've saved it,", "caption": "6. Confirm you've saved it", "duration_sec": 3.5 },
    { "id": "recovery_continue", "action": "move_and_click",
      "target": { "selector": "#btn-recovery-continue", "window": "ScanFinder — Sign in" },
      "narration": "then Continue.", "caption": "7. Continue", "duration_sec": 3 },

    { "id": "licence_intro", "action": "wait",
      "wait_for": { "window": "Licence", "selector": "#trial", "timeout": 30 },
      "narration": "Next, ScanFinder asks for a licence. You see this screen once per computer, and it needs the internet only for this step.",
      "caption": "Licence — once per computer, online just for this", "duration_sec": 8 },
    { "id": "trial_fields", "action": "move_to",
      "target": { "selector": "#trial_customer", "window": "Licence" },
      "narration": "For the free 14-day trial, enter your company name, your name and an email address,",
      "caption": "8. Free trial: company, name, email", "duration_sec": 6 },
    { "id": "trial_button", "action": "move_to",
      "target": { "selector": "#trial", "window": "Licence" },
      "narration": "then click Start trial. The trial is tied to this computer.",
      "caption": "9. Start trial — tied to this PC", "duration_sec": 5 },
    { "id": "activation_key", "action": "move_to",
      "target": { "selector": "#key", "window": "Licence" },
      "narration": "Already bought Scan Finder? Paste the activation key from your purchase email here, optionally name this device, and click Activate.",
      "caption": "Bought it? Paste the activation key → Activate", "duration_sec": 7.5 },
    { "id": "licence_outro", "action": "wait",
      "narration": "Once the trial starts or the key is accepted, ScanFinder continues to the Terms of Use.",
      "caption": "Next: the Terms of Use", "duration_sec": 4.5 }
  ]
}
